{
  "schemaVersion": "1.0.0",
  "reviewId": "DEP-0205",
  "generatedAt": "2026-09-05T17:30:00.000Z",
  "candidate": {
    "release": "project-skills-orchestrator 1.1.1, commit 519095930b7deb08606380e7ea9f014ff2b07416",
    "targetEnvironment": "authorized internal production distribution",
    "carriesProductionData": false,
    "blastRadius": "Recipients use the package to create or modify development repositories and agent configuration; a bad release can affect generated project setup and workflow guidance."
  },
  "decision": "blocked",
  "gates": [
    {
      "gate": "build-reproducibility",
      "state": "pass",
      "evidence": [
        "npm run check passed 107 tests with one platform-alias skip and all 43 skills before report-only evidence updates.",
        "The rebuilt unsigned candidate verifies 151 checksum-covered files and includes CycloneDX SBOM and in-toto provenance.",
        "Release-source cleanliness passes for commit 5190959; only non-shipped report evidence differs locally.",
        "Two consecutive builds produced identical SHA256SUMS digest fdf8220092850f2d5baf6669fad37167b815a69a21099f992a1e23c65c9ace2c."
      ]
    },
    {
      "gate": "configuration-completeness",
      "state": "pass",
      "evidence": [
        "release/release-manifest.json requires standalone output, checksums, private package, SBOM, provenance, trusted signature, independent review, and three-platform evidence.",
        "README.md and SECURITY.md restrict distribution to authorized internal use and keep production release fail-closed."
      ]
    },
    {
      "gate": "environment-parity",
      "state": "pass",
      "evidence": [
        "Security Validation run 33980792156 passed all nine Windows/Linux/macOS Node 22/24/26 jobs, three Gitleaks history jobs, and aggregate evidence for 5190959.",
        "CodeQL run 33980792246 passed for 5190959 and uploaded results; reviewed dispositions leave zero open alerts."
      ]
    },
    {
      "gate": "security-findings-closed",
      "state": "fail",
      "evidence": [
        "Local built-in security and pinned Gitleaks scans pass without findings in their approved scopes.",
        "SECF-0205 is reduced to the missing independent human-review requirement; automated branch, secret, dependency, CodeQL, and vulnerability-reporting safeguards are enabled.",
        "Trusted release signature and independently signed review evidence are not provisioned."
      ]
    },
    {
      "gate": "architecture-findings-closed",
      "state": "fail",
      "evidence": [
        "ARCF-0205 records that an independent human source review cannot be required until a second qualified collaborator exists.",
        "No owner has accepted that high-severity architecture finding."
      ]
    },
    {
      "gate": "data-safety",
      "state": "not-applicable",
      "evidence": [
        "The package is a registry-free CLI and does not carry production application data or perform deployment migrations"
      ]
    },
    {
      "gate": "observability",
      "state": "fail",
      "evidence": [
        "Release, security response, and artifact revocation roles are assigned to @QuyDu, but no approved internal artifact destination, installation-health signal, or tested revocation operation exists."
      ]
    }
  ],
  "verification": [
    {
      "signal": "release:verify against the signed candidate",
      "expected": "Signature, checksum, SBOM, provenance, and independent review verify with externally trusted key fingerprints."
    },
    {
      "signal": "cross-platform CI evidence commit field",
      "expected": "Every required Windows, Linux, and macOS run on Node 22, 24, and 26 references the clean commit containing the complete candidate source."
    },
    {
      "signal": "independent review decision",
      "expected": "A qualified reviewer who did not author the release signs an evidence record bound to the candidate and resolves or accepts findings by named owner."
    },
    {
      "signal": "generated-project smoke test",
      "expected": "A fresh project can be created, verified, updated, and can run its documented help and Azure Discovery workflows without unintended external mutation."
    }
  ],
  "rollback": {
    "route": "Stop internal distribution, retain the candidate for investigation, and restore the previous approved package version. For already-created projects, use the transactional project recovery workflow and restore from the project backup or prior Git revision.",
    "triggerConditions": [
      "Candidate signature, checksum, or provenance verification fails",
      "A generated-project smoke test modifies an unowned path or exposes secret material",
      "A critical or high-severity security finding is discovered",
      "Cross-platform behavior diverges from the candidate evidence"
    ],
    "estimatedDuration": "Stop distribution immediately; package rollback is expected within one release operation, while affected project recovery depends on each repository backup and transaction journal.",
    "irreversibleSteps": [
      "Any user-generated project changes made after applying this package cannot be automatically undone without a repository backup or explicit recovery decision."
    ]
  },
  "limitations": [
    "No live Azure environment or deployment was accessed.",
    "Read-only hosted evidence was retrieved, but no GitHub setting or workflow was mutated or dispatched.",
    "The candidate is unsigned and has no independent review record bound to its exact source set.",
    "Cross-platform and CodeQL evidence is current for exact candidate commit 5190959.",
    "Observability for package distribution and generated-project runtime behavior is not established in repository evidence."
  ]
}
